{
  "catalogId": "formula-catalog",
  "version": "1.1.0",
  "status": "ACTIVE_AUTHORITY",
  "invariants": [
    "every active metric resolves to exactly one FormulaDefinition",
    "all inputs and available outputs are canonical DecimalString values",
    "all arithmetic uses decimal.js v10+ with arbitrary precision and ROUND_HALF_EVEN",
    "persisted computed decimals are rounded to scale 12 before canonical serialization; trailing zeros are removed",
    "zero is serialized only as 0; -0 and exponential notation are forbidden",
    "evaluation follows evaluationPrecedence exactly and returns the first applicable reasonCode",
    "local clock, locale, timezone and binary floating point never influence formula output or fingerprints",
    "unavailable states never persist a fabricated numeric value"
  ],
  "reasonCodes": [
    "invalid_arity",
    "required_input_missing",
    "invalid_input",
    "non_canonical_decimal",
    "insufficient_observations",
    "zero_denominator",
    "non_finite_result",
    "invalid_price_observation",
    "incomplete_debt_buckets",
    "overlapping_debt_buckets"
  ],
  "formulas": [
    {
      "formulaId": "identity",
      "formulaVersion": "1.1.0",
      "priority": 10,
      "arity": {
        "minimum": 1,
        "maximum": 1
      },
      "inputKind": "scalar",
      "expression": "x",
      "semantics": "Devuelve el input decimal sin modificar su valor.",
      "decimalPolicy": {
        "library": "decimal.js",
        "input": "canonical DecimalString",
        "precision": "arbitrary",
        "persistedScale": 12,
        "rounding": "ROUND_HALF_EVEN",
        "serialization": "round to scale 12 with ROUND_HALF_EVEN, then decimal.js toString() canonical form",
        "clockDependency": "PROHIBITED"
      },
      "orderingPolicy": "inputIds order is normative; series are sorted by validated observation date ascending before evaluation",
      "negativeValuePolicy": "preserve valid accounting negatives; never apply absolute value silently",
      "edgeCases": [
        {
          "condition": "input count violates the declared arity",
          "state": "insufficient",
          "reasonCode": "invalid_arity",
          "valueMustBeAbsent": true
        },
        {
          "condition": "a required input position is absent or null",
          "state": "insufficient",
          "reasonCode": "required_input_missing",
          "valueMustBeAbsent": true
        },
        {
          "condition": "an input is not a finite base-10 decimal string or violates the input kind",
          "state": "insufficient",
          "reasonCode": "invalid_input",
          "valueMustBeAbsent": true
        },
        {
          "condition": "an input is numerically parseable but is not canonical DecimalString",
          "state": "insufficient",
          "reasonCode": "non_canonical_decimal",
          "valueMustBeAbsent": true
        },
        {
          "condition": "arithmetic output is non-finite",
          "state": "insufficient",
          "reasonCode": "non_finite_result",
          "valueMustBeAbsent": true
        }
      ],
      "outputContract": {
        "availableValue": "canonical DecimalString",
        "unavailableValue": "omitted",
        "stateRequired": true,
        "reasonCodeRequiredWhenUnavailable": true
      }
    },
    {
      "formulaId": "add",
      "formulaVersion": "1.1.0",
      "priority": 20,
      "arity": {
        "minimum": 2,
        "maximum": null
      },
      "inputKind": "ordered_scalars",
      "expression": "Σ inputs",
      "semantics": "Suma los inputs en el orden declarado.",
      "decimalPolicy": {
        "library": "decimal.js",
        "input": "canonical DecimalString",
        "precision": "arbitrary",
        "persistedScale": 12,
        "rounding": "ROUND_HALF_EVEN",
        "serialization": "round to scale 12 with ROUND_HALF_EVEN, then decimal.js toString() canonical form",
        "clockDependency": "PROHIBITED"
      },
      "orderingPolicy": "inputIds order is normative; series are sorted by validated observation date ascending before evaluation",
      "negativeValuePolicy": "preserve valid accounting negatives; never apply absolute value silently",
      "edgeCases": [
        {
          "condition": "input count violates the declared arity",
          "state": "insufficient",
          "reasonCode": "invalid_arity",
          "valueMustBeAbsent": true
        },
        {
          "condition": "a required input position is absent or null",
          "state": "insufficient",
          "reasonCode": "required_input_missing",
          "valueMustBeAbsent": true
        },
        {
          "condition": "an input is not a finite base-10 decimal string or violates the input kind",
          "state": "insufficient",
          "reasonCode": "invalid_input",
          "valueMustBeAbsent": true
        },
        {
          "condition": "an input is numerically parseable but is not canonical DecimalString",
          "state": "insufficient",
          "reasonCode": "non_canonical_decimal",
          "valueMustBeAbsent": true
        },
        {
          "condition": "arithmetic output is non-finite",
          "state": "insufficient",
          "reasonCode": "non_finite_result",
          "valueMustBeAbsent": true
        }
      ],
      "outputContract": {
        "availableValue": "canonical DecimalString",
        "unavailableValue": "omitted",
        "stateRequired": true,
        "reasonCodeRequiredWhenUnavailable": true
      }
    },
    {
      "formulaId": "subtract",
      "formulaVersion": "1.1.0",
      "priority": 30,
      "arity": {
        "minimum": 2,
        "maximum": 2
      },
      "inputKind": "ordered_scalars",
      "expression": "input[0] - input[1]",
      "semantics": "Resta el segundo input al primero.",
      "decimalPolicy": {
        "library": "decimal.js",
        "input": "canonical DecimalString",
        "precision": "arbitrary",
        "persistedScale": 12,
        "rounding": "ROUND_HALF_EVEN",
        "serialization": "round to scale 12 with ROUND_HALF_EVEN, then decimal.js toString() canonical form",
        "clockDependency": "PROHIBITED"
      },
      "orderingPolicy": "inputIds order is normative; series are sorted by validated observation date ascending before evaluation",
      "negativeValuePolicy": "preserve valid accounting negatives; never apply absolute value silently",
      "edgeCases": [
        {
          "condition": "input count violates the declared arity",
          "state": "insufficient",
          "reasonCode": "invalid_arity",
          "valueMustBeAbsent": true
        },
        {
          "condition": "a required input position is absent or null",
          "state": "insufficient",
          "reasonCode": "required_input_missing",
          "valueMustBeAbsent": true
        },
        {
          "condition": "an input is not a finite base-10 decimal string or violates the input kind",
          "state": "insufficient",
          "reasonCode": "invalid_input",
          "valueMustBeAbsent": true
        },
        {
          "condition": "an input is numerically parseable but is not canonical DecimalString",
          "state": "insufficient",
          "reasonCode": "non_canonical_decimal",
          "valueMustBeAbsent": true
        },
        {
          "condition": "arithmetic output is non-finite",
          "state": "insufficient",
          "reasonCode": "non_finite_result",
          "valueMustBeAbsent": true
        }
      ],
      "outputContract": {
        "availableValue": "canonical DecimalString",
        "unavailableValue": "omitted",
        "stateRequired": true,
        "reasonCodeRequiredWhenUnavailable": true
      }
    },
    {
      "formulaId": "divide",
      "formulaVersion": "1.1.0",
      "priority": 40,
      "arity": {
        "minimum": 2,
        "maximum": 2
      },
      "inputKind": "ordered_scalars",
      "expression": "input[0] / input[1]",
      "semantics": "Divide numerador por denominador.",
      "decimalPolicy": {
        "library": "decimal.js",
        "input": "canonical DecimalString",
        "precision": "arbitrary",
        "persistedScale": 12,
        "rounding": "ROUND_HALF_EVEN",
        "serialization": "round to scale 12 with ROUND_HALF_EVEN, then decimal.js toString() canonical form",
        "clockDependency": "PROHIBITED"
      },
      "orderingPolicy": "inputIds order is normative; series are sorted by validated observation date ascending before evaluation",
      "negativeValuePolicy": "preserve valid accounting negatives; never apply absolute value silently",
      "edgeCases": [
        {
          "condition": "input count violates the declared arity",
          "state": "insufficient",
          "reasonCode": "invalid_arity",
          "valueMustBeAbsent": true
        },
        {
          "condition": "a required input position is absent or null",
          "state": "insufficient",
          "reasonCode": "required_input_missing",
          "valueMustBeAbsent": true
        },
        {
          "condition": "an input is not a finite base-10 decimal string or violates the input kind",
          "state": "insufficient",
          "reasonCode": "invalid_input",
          "valueMustBeAbsent": true
        },
        {
          "condition": "an input is numerically parseable but is not canonical DecimalString",
          "state": "insufficient",
          "reasonCode": "non_canonical_decimal",
          "valueMustBeAbsent": true
        },
        {
          "condition": "effective denominator equals zero",
          "state": "not_meaningful",
          "reasonCode": "zero_denominator",
          "valueMustBeAbsent": true
        },
        {
          "condition": "arithmetic output is non-finite",
          "state": "insufficient",
          "reasonCode": "non_finite_result",
          "valueMustBeAbsent": true
        }
      ],
      "outputContract": {